{
  "cenario": {
    "municipio": "Patos de Minas",
    "cod_ibge": 3148004,
    "safra": "2026/27",
    "area_total_ha": 600,
    "n_talhoes": 3,
    "n_rotacoes": 6
  },
  "dados": {
    "status": "PARCIAL",
    "observacao": "Janelas: REAIS (ZARC 2026/27, engine/adequacao.py). Margens: MOCK — aguardando engine/margens_mc.json (MC do M1). Atualize com engine/atualiza_config.py quando o MC do M1 entregar engine/margens_mc.json.",
    "gerado_em": "2026-10-24T17:34:22",
    "engine": "engine/ — CP-SAT inteiro: lexicográfico margem→risco, fronteira ε-constraint com knee (Equilibrado) e Monte Carlo de robustez"
  },
  "talhoes": {
    "T1": {
      "area_ha": 300,
      "grupo_solo": 2
    },
    "T2": {
      "area_ha": 200,
      "grupo_solo": 1
    },
    "T3": {
      "area_ha": 100,
      "grupo_solo": 3
    }
  },
  "rotacoes": {
    "soja_milho": {
      "culturas": [
        "soja",
        "milho safrinha"
      ],
      "margem_centavos_por_ha": 418000,
      "margem_reais_por_ha": 4180.0,
      "risco_por_mil": 120,
      "janelas_viveis_decendios": {
        "1": [],
        "2": [
          28,
          29
        ],
        "3": [
          28,
          29,
          30
        ]
      },
      "grupos_viveis": [
        2,
        3
      ],
      "hipoteses": [
        {
          "chave": "produtividade_soja",
          "valor": "55 sc/ha",
          "fonte_url": "MOCK://hackatohm/pam-media-20anos",
          "metodo": "média PAM 20 anos (MOCK)"
        },
        {
          "chave": "preco_soja",
          "valor": "R$ 130/sc",
          "fonte_url": "MOCK://hackatohm/conab-media-5-safras",
          "metodo": "média Conab 5 safras (MOCK)"
        },
        {
          "chave": "produtividade_milho_safrinha",
          "valor": "80 sc/ha",
          "fonte_url": "MOCK://hackatohm/pam-media-20anos",
          "metodo": "média PAM 20 anos (MOCK)"
        },
        {
          "chave": "custo_total",
          "valor": "R$ 7.610/ha",
          "fonte_url": "MOCK://hackatohm/custos-regionais",
          "metodo": "planilha de custos regional (MOCK)"
        },
        {
          "chave": "observacao",
          "valor": "margens ainda MOCK — aguardando engine/margens_mc.json do MC do M1",
          "fonte_url": "MOCK://hackatohm/m1-monte-carlo-pendente",
          "metodo": "margens provisórias do config.yaml (MOCK) — substituir pelo MC do M1"
        },
        {
          "chave": "janelas_zarc",
          "valor": "ZARC 2026/27 — janelas pareadas (ciclo Grupo I)",
          "fonte_url": "https://dados.agricultura.gov.br/dataset/tabua-de-risco-zoneamento-agricola-de-risco-climatico",
          "metodo": "engine/adequacao.py + portaria MAPA"
        },
        {
          "chave": "janela_segunda_cultura",
          "valor": "plantio da 2ª cultura — g1: sem janela (inviável) · g2: [2-3] · g3: [2-4]",
          "fonte_url": "https://dados.agricultura.gov.br/dataset/tabua-de-risco-zoneamento-agricola-de-risco-climatico",
          "metodo": "janelas pareadas do ZARC — engine/adequacao.py"
        }
      ]
    },
    "soja_sorgo": {
      "culturas": [
        "soja",
        "sorgo safrinha"
      ],
      "margem_centavos_por_ha": 390000,
      "margem_reais_por_ha": 3900.0,
      "risco_por_mil": 110,
      "janelas_viveis_decendios": {
        "1": [
          28,
          29,
          30
        ],
        "2": [
          28,
          29,
          30,
          31
        ],
        "3": [
          28,
          29,
          30,
          31,
          32
        ]
      },
      "grupos_viveis": [
        1,
        2,
        3
      ],
      "hipoteses": [
        {
          "chave": "produtividade_soja",
          "valor": "55 sc/ha",
          "fonte_url": "MOCK://hackatohm/pam-media-20anos",
          "metodo": "média PAM 20 anos (MOCK)"
        },
        {
          "chave": "produtividade_sorgo",
          "valor": "4.000 kg/ha",
          "fonte_url": "MOCK://hackatohm/pam-media-20anos",
          "metodo": "média PAM 20 anos (MOCK)"
        },
        {
          "chave": "preco_sorgo",
          "valor": "R$ 0,55/kg",
          "fonte_url": "MOCK://hackatohm/conab-media-5-safras",
          "metodo": "média Conab 5 safras (MOCK)"
        },
        {
          "chave": "custo_total",
          "valor": "R$ 5.450/ha",
          "fonte_url": "MOCK://hackatohm/custos-regionais",
          "metodo": "planilha de custos regional (MOCK)"
        },
        {
          "chave": "observacao",
          "valor": "margens ainda MOCK — aguardando engine/margens_mc.json do MC do M1",
          "fonte_url": "MOCK://hackatohm/m1-monte-carlo-pendente",
          "metodo": "margens provisórias do config.yaml (MOCK) — substituir pelo MC do M1"
        },
        {
          "chave": "janelas_zarc",
          "valor": "ZARC 2026/27 — janelas pareadas (ciclo Grupo I)",
          "fonte_url": "https://dados.agricultura.gov.br/dataset/tabua-de-risco-zoneamento-agricola-de-risco-climatico",
          "metodo": "engine/adequacao.py + portaria MAPA"
        },
        {
          "chave": "janela_segunda_cultura",
          "valor": "plantio da 2ª cultura — g1: [2-4] · g2: [2-5] · g3: [2-6]",
          "fonte_url": "https://dados.agricultura.gov.br/dataset/tabua-de-risco-zoneamento-agricola-de-risco-climatico",
          "metodo": "janelas pareadas do ZARC — engine/adequacao.py"
        }
      ]
    },
    "feijao_sorgo": {
      "culturas": [
        "feijão das águas",
        "sorgo safrinha"
      ],
      "margem_centavos_por_ha": 450000,
      "margem_reais_por_ha": 4500.0,
      "risco_por_mil": 250,
      "janelas_viveis_decendios": {
        "1": [
          29,
          30,
          31
        ],
        "2": [
          28,
          29,
          30,
          31,
          32
        ],
        "3": [
          28,
          29,
          30,
          31,
          32,
          33
        ]
      },
      "grupos_viveis": [
        1,
        2,
        3
      ],
      "hipoteses": [
        {
          "chave": "produtividade_feijao",
          "valor": "1.200 kg/ha",
          "fonte_url": "MOCK://hackatohm/pam-media-20anos",
          "metodo": "média PAM 20 anos (MOCK)"
        },
        {
          "chave": "preco_feijao",
          "valor": "R$ 9,00/kg",
          "fonte_url": "MOCK://hackatohm/conab-media-5-safras",
          "metodo": "média Conab 5 safras (MOCK)"
        },
        {
          "chave": "produtividade_sorgo",
          "valor": "4.000 kg/ha",
          "fonte_url": "MOCK://hackatohm/pam-media-20anos",
          "metodo": "média PAM 20 anos (MOCK)"
        },
        {
          "chave": "custo_total",
          "valor": "R$ 8.500/ha",
          "fonte_url": "MOCK://hackatohm/custos-regionais",
          "metodo": "planilha de custos regional (MOCK)"
        },
        {
          "chave": "observacao",
          "valor": "margens ainda MOCK — aguardando engine/margens_mc.json do MC do M1",
          "fonte_url": "MOCK://hackatohm/m1-monte-carlo-pendente",
          "metodo": "margens provisórias do config.yaml (MOCK) — substituir pelo MC do M1"
        },
        {
          "chave": "janelas_zarc",
          "valor": "ZARC 2026/27 — janelas pareadas (ciclo Grupo I)",
          "fonte_url": "https://dados.agricultura.gov.br/dataset/tabua-de-risco-zoneamento-agricola-de-risco-climatico",
          "metodo": "engine/adequacao.py + portaria MAPA"
        },
        {
          "chave": "janela_segunda_cultura",
          "valor": "plantio da 2ª cultura — g1: [2-4] · g2: [1-5] · g3: [1-6]",
          "fonte_url": "https://dados.agricultura.gov.br/dataset/tabua-de-risco-zoneamento-agricola-de-risco-climatico",
          "metodo": "janelas pareadas do ZARC — engine/adequacao.py"
        }
      ]
    },
    "milho_verao": {
      "culturas": [
        "milho 1ª safra"
      ],
      "margem_centavos_por_ha": 260000,
      "margem_reais_por_ha": 2600.0,
      "risco_por_mil": 90,
      "janelas_viveis_decendios": {
        "1": [
          31,
          32,
          33,
          34,
          35
        ],
        "2": [
          30,
          31,
          32,
          33,
          34,
          35,
          36
        ],
        "3": [
          30,
          31,
          32,
          33,
          34,
          35,
          36
        ]
      },
      "grupos_viveis": [
        1,
        2,
        3
      ],
      "hipoteses": [
        {
          "chave": "produtividade_milho",
          "valor": "110 sc/ha",
          "fonte_url": "MOCK://hackatohm/pam-media-20anos",
          "metodo": "média PAM 20 anos (MOCK)"
        },
        {
          "chave": "preco_milho",
          "valor": "R$ 58/sc",
          "fonte_url": "MOCK://hackatohm/conab-media-5-safras",
          "metodo": "média Conab 5 safras (MOCK)"
        },
        {
          "chave": "custo_total",
          "valor": "R$ 3.780/ha",
          "fonte_url": "MOCK://hackatohm/custos-regionais",
          "metodo": "planilha de custos regional (MOCK)"
        },
        {
          "chave": "observacao",
          "valor": "margens ainda MOCK — aguardando engine/margens_mc.json do MC do M1",
          "fonte_url": "MOCK://hackatohm/m1-monte-carlo-pendente",
          "metodo": "margens provisórias do config.yaml (MOCK) — substituir pelo MC do M1"
        },
        {
          "chave": "janelas_zarc",
          "valor": "ZARC 2026/27 — janela de plantio (solteira, melhor ciclo)",
          "fonte_url": "https://dados.agricultura.gov.br/dataset/tabua-de-risco-zoneamento-agricola-de-risco-climatico",
          "metodo": "engine/adequacao.py + portaria MAPA"
        }
      ]
    },
    "soja_solteira": {
      "culturas": [
        "soja"
      ],
      "margem_centavos_por_ha": 360000,
      "margem_reais_por_ha": 3600.0,
      "risco_por_mil": 130,
      "janelas_viveis_decendios": {
        "1": [
          1,
          28,
          29,
          30,
          31,